Title,Date
"Local Jobs, Local Wealth and a Fix for Climate Change - The Lane Report",2020-07-31
John Tyndall: the forgotten co-founder of climate science - The Conversation UK,2020-07-31
Guardians of Mexico's community forests confront climate change - Mongabay.com,2020-07-31
"Ireland forced to strengthen climate plan, in supreme court win for campaigners - Climate Home",2020-07-31
Climate change and COVID-19: The denial playbook is the same - Phys.org,2020-07-31
Why Alarm Over Climate Change Is Not Alarmism - Bloomberg,2020-07-31
Nature on the move from climate change - North Country Public Radio,2020-07-31
There's a heatwave at the Arctic 'doomsday vault' in Norway - World Economic Forum,2020-07-31
Stop blaming cows for climate change - MyNorthwest.com,2020-07-31
Irish citizens win case to force government action on climate change - Euronews,2020-07-31
Physics - The Complex Variability of Climate - Physics,2020-07-31
UN appoints Indian Archana Soreng to Youth Advisory Group on Climate Change - Vatican News,2020-07-31
"Climate Change is Driving UK's Extreme Weather Events, Reveals Climate Report | The Weather Channel - Articles from The Weather Channel | weather.com - The Weather Channel",2020-07-31
A Climate Action Plan for Wisconsin - Door County Pulse,2020-07-31
'Fingerprint' of the climate crisis in flooding that has left a third of Bangladesh under water - The Independent,2020-07-31
Climate change warming: TWO polar ice caps VANISH in three years - Daily Express,2020-07-31
Global warming is producing longer summers in northern Norway - The Independent Barents Observer,2020-07-31
"Explained: How sea level rise could impact millions of people, cost billions of dollars - The Indian Express",2020-07-31
Climate Point: Saving the Amazon and sourcing clean water for Navajo Nation - USA TODAY,2020-07-31
Apocalypse Soon: Disaster Movies About Climate Change Now Play As Metaphors For Coronavirus - Forbes,2020-07-31
What is Environmental Racism And How Can We Fight It? - World Economic Forum,2020-07-31
Supreme Court quashes Government's plan to reduce greenhouse gases - The Irish Times,2020-07-31
Stephen Batchelor: Facing the Climate Crisis - Tricycle - Tricycle,2020-07-31
Architecture schools need to reform their teaching to combat climate change - Architects Journal,2020-07-31
Research begins on how climate change affects Pacific identities - RNZ,2020-07-31
How this Dutch city is redesigning itself for extreme heat - Fast Company,2020-07-31
'Climate change-resistant' apple that can keep its colour and crunch could be grown in Australia - ABC News,2020-07-31
Who should be responsible for removing CO2 from the atmosphere? - World Economic Forum,2020-07-31
Reduced coral reef fish biodiversity under temperatures that mirror climate predictions - Phys.org,2020-07-31
US report highlights nuclear export opportunities : Corporate - World Nuclear News,2020-07-31
"Supreme Court finds government climate plan falls ""well short"" - TheJournal.ie",2020-07-31
"Book review: Riders on the Storm, by Alastair McIntosh - The Scotsman",2020-07-31
Third hottest day on record comes as Met Office issues climate change warning - ITV News,2020-07-31
Hartlepool drawing up battle plan to deal with climate change - but leader doesn't want 'copy and paste ideas' - Hartlepool Mail,2020-07-31
Analysis | Could Democrats get rid of the filibuster next year? - The Washington Post,2020-07-31
"IN FOCUS: 'It is not easy, but it can be done' - The challenges of raising Singapore's recycling rate - CNA",2020-07-31
The ‘Idiot’s Guide to Climate Change’ is smarter than Zac Efron’s - Grist,2020-08-01
The Global Environmental Apocalypse Has Been Canceled - Reason,2020-08-01
"Book Digest: Tracking COVID-19 lockdown, climate crisis impact on young people and more - Down To Earth Magazine",2020-08-01
The areas of Wales set to be underwater in 30 years due to climate change - Wales Online,2020-08-01
"Climate strikes, environmental protests in July 2020 - Anadolu Agency",2020-08-01
Should Plants and Animals That Relocate Because of Climate Change Be Considered Invasive? - Smithsonian Magazine,2020-08-02
"Explainer: Man-made climate change, is it real or fake? - CNA",2020-08-02
"The Climate Connection: All of a Piece: COVID-19, climate change and social justice - Napa Valley Register",2020-08-02
How climate change is affecting Maharashtra fish catch - Mongabay-India,2020-08-02
Effects Of Climate Change On The Arctic Peoples Of The World - World Atlas,2020-08-02
Class Assignment: Building An Island Community Capable Of Thriving Amid Climate Change - Mountain Journal,2020-08-02
Commentary: Climate change makes dealing with COVID-19 look easy - CNA,2020-08-02
How Changing Climate Conditions Are Altering Building Design - Interesting Engineering,2020-08-02
First climate change risk assessment lays out long list of threats - Stuff.co.nz,2020-08-02
The Kent areas under threat of disappearing underwater due to climate change - Kent Live,2020-08-02
One cut after the other Climate change killing the Caribbean - Jamaica Observer,2020-08-02
More than heatwaves: New report details biggest climate change risks to NZ - The Spinoff,2020-08-02
Research begins on how climate change affects Pacific identities - Fiji Times,2020-08-02
Climate change risks and opportunities outlined in government report - RNZ,2020-08-02
COMMENTARY: Climate change killing the Caribbean one cut after the other - Barbados Advocate,2020-08-02
"Climate report: 'Extreme risk' to people, buildings and water supplies - New Zealand Herald",2020-08-02
How climate change affects ancient glaciers in Bhutan | Video - CNA,2020-08-02
"Report: NZ due for wildfires, storms, droughts - Newsroom",2020-08-02
How to Be an Effective Online Ally for the Social and Environmental Justice Fight - EcoWatch,2020-08-02
Why post-Merkel Germany will change its tune on China - POLITICO.eu,2020-08-02
The Worst-Case Scenario for Global Warming Tracks Closely With Actual Emissions - InsideClimate News,2020-08-03
The Coronavirus is Making it Easier to Talk About Climate Change. Here's Why. - EP Magazine,2020-08-03
"'Worst-case' global warming scenario still best guide until 2050, study says - Climate Home",2020-08-03
"Climate Change is Inevitable, Good Policy is Critical - The Ripon Society - The Ripon Society",2020-08-03
'Extreme' glacier loss events linked to human-caused climate change for first time - Carbon Brief,2020-08-03
Portugal's Vintners on the Forefront of Climate Change - SevenFifty Daily,2020-08-03
Major news outlets are handing the mic to big business on climate issues - Popular Science,2020-08-03
"As Global Temperatures Rise, Wealthy Better Able to Prevent Heat Related Illness, Heat Stroke - Bloomberg",2020-08-03
Let's Hire Laid-Off Oil and Gas Workers to Fight Climate Change - Bloomberg,2020-08-03
Climate Science Moves Online - NPR,2020-08-03
"Joe Biden's climate change plan, explained - PolitiFact",2020-08-03
'There’s still a choice': New Zealand's melting glaciers show the human fingerprints of climate change - The Guardian,2020-08-03
The UCS Science Hub for Climate Litigation - Union of Concerned Scientists,2020-08-03
Animal Agriculture and Its Negative Impact on Climate Change - Sentient Media,2020-08-03
"'If RCP8.5 Did Not Exist, We'd Have to Create It' for Climate Change by 2050 - Newsweek",2020-08-03
How climate change made the melting of New Zealand's glaciers 10 times more likely - The Conversation AU,2020-08-03
"To Young Republicans, Climate Change is Fact, Not Fiction - The Ripon Society",2020-08-03
Rainn Wilson to Host New Climate Change Series - LIVEKINDLY,2020-08-03
NZ glacier melt linked to climate change - Cosmos,2020-08-03
"Putting A Price On Carbon: It Was Hot, Now It's Not - WBUR",2020-08-03
"August 2020: Global Environmental Health Day tackles big issues, showcases research - Environmental Factor Newsletter",2020-08-03
"Fresh water is pouring into the Arctic Ocean. Climate change is to blame, new study says - CBC.ca",2020-08-03
The evolution of Extinction Rebellion | Extinction Rebellion - The Guardian,2020-08-03
Private equity investors commit to action on climate change - Private Equity Wire,2020-08-03
Photographer Sean Gallagher Interviewed by Documenting Climate Change Podcast - Pulitzer Center on Crisis Reporting,2020-08-03
Peatlands could become a climate feedback loop we definitely don’t want to trigger - Grist,2020-08-03
UCT researchers selected for global climate change report - University of Cape Town News,2020-08-03
First Person: Turning 'apathetic people into climate activists'; a young person's view - UN News,2020-08-03
Two-thirds of glacier ice in the Himalayas will be lost by 2100 if climate targets aren't met - The Conversation UK,2020-08-03
UK weather alert: Britain's coast at risk as scientists issue dire climate change warning - Daily Express,2020-08-03
The low carbon path to fix effects of climate change - Khmer Times,2020-08-03
"Yes, Senator, climate change is real: A Liberal MP's open letter to One Nation's Malcolm Roberts - Sydney Morning Herald",2020-08-03
"Ebonyi government unveils climate change policy, action plan - Guardian Nigeria",2020-08-03
"With big rallies cancelled, young climate activists are adapting election tactics - The Guardian",2020-08-03
The Problem With Plastic - NBC 6 South Florida,2020-08-03
"2020 International Climate Action Challenge: 1,000 Eco-Initiatives in 90 Days - PRNewswire",2020-08-03
Climate change resilience projects get $100 million from Government - Stuff.co.nz,2020-08-03
The battle against climate change - New Zealand Herald,2020-08-03
Does Optimism on Climate Change Make You Pro-Trump? - Scientific American,2020-08-04
Waning attention to climate change amid pandemic could have lasting effects - CU Boulder Today,2020-08-04
Explorer's mission to photograph a century of climate change in Patagonia - CNN,2020-08-04
Here Are 20 Ways Colorado Farmers And Ranchers Already Experience Climate Change - Colorado Public Radio,2020-08-04
Scientists Dissect The Tactics Of Climate Delayers - Forbes,2020-08-04
Climate change: Satellites find new colonies of Emperor penguins - BBC News,2020-08-04
SoCalGas sues California over climate change policy - Los Angeles Times,2020-08-04
Flooding could occur daily in Sydney by the end of this century because of climate change - The Guardian,2020-08-04
"Shellenberger's Optimistic, Viral Take on Climate Future Challenged by Scientists He Cites - Snopes.com",2020-08-04
Dutch city Arnhem swaps asphalt for trees to adapt to climate change - Dezeen,2020-08-04
Rising temperatures will cause more deaths than all infectious diseases – study - The Guardian,2020-08-04
BP lays out rapid cuts in oil and gas production to reach net-zero carbon emissions - The Washington Post,2020-08-04
"What the pandemic has revealed about climate change views, activism - Minnesota Public Radio News",2020-08-04
"BP Pledges to Cut Oil and Gas Production 40 Percent by 2030, but Some Questions Remain - InsideClimate News",2020-08-04
Reindeer and Their Nomadic Herders Face Climate Change - EcoWatch,2020-08-04
The response to COVID-19 must protect the planet - World Economic Forum,2020-08-04
Rising Temperatures Could Kill More People Than All Infectious Diseases Combined: Study - Global Citizen,2020-08-04
Scientists believe climate change impacts likely behind low marine catch in India - SeafoodSource,2020-08-04
"What Is Climate Change, Explained By Italian Illustrators In 23 Fairy Tales - Forbes",2020-08-04
This Landmark Climate Case in Ireland Might Be 'Huge' for the Rest of Europe Too - Global Citizen,2020-08-04
'Worst-case' CO2 emissions scenario is best for assessing climate risk and impacts to 2050: RCP 8.5 tracks within 1% of actual emissions - Science Daily,2020-08-04
Are your seasonal allergies getting worse? Blame climate change. | COMMENTARY - Baltimore Sun,2020-08-04
Extreme heat: What can be done to stop this “silent killer”? - Atlantic Council,2020-08-04
Can TV affect our attitudes to climate change and carbon emissions? - Sydney Morning Herald,2020-08-04
Researchers Warn A Warming Ocean Threatens Giant Kelp Forests - KPBS,2020-08-04
Which states are making the most progress on emissions? Not the ones you think. - Grist,2020-08-04
How the seafloor of the Antarctic Ocean is changing - and the climate is following suit - Science Daily,2020-08-04
"Saudi Aramco, other oil giants join efforts to mitigate climate change | | AW - The Arab Weekly",2020-08-04
Supreme Court: Government's climate change plan quashed - Irish Legal News,2020-08-04
Moving towards a climate-resilient Singapore - TODAY - TODAYonline,2020-08-04
"New England's trees capturing more carbon, says 25-year study - Harvard Gazette",2020-08-04
The conservative's guide to acting on climate change - The Canberra Times,2020-08-04
How climate change could be a factor in UK free trade deal - Stuff.co.nz,2020-08-04
"NZ rated 'insufficient' on climate action, again - Stuff.co.nz",2020-08-04
Meet the young people pushing Maine forward on climate change - Energy News Network,2020-08-05
An effective climate change solution may lie in rocks beneath our feet | Greenbiz - GreenBiz,2020-08-05
What can you do to fight the climate crisis? - The Guardian,2020-08-05
"How Climate Change Affects Allergies, Immune Response and Autism - Rutgers Today",2020-08-05
Bill Gates warns climate change could be worse than the coronavirus - CNET,2020-08-05
Experts discuss ways to predict and hopefully curb climate change - University of Miami,2020-08-05
"Without action on climate change, heat is projected to become major global killer - AZCentral",2020-08-05
Arboretum examines climate change's impact on maple trees - Harvard Gazette,2020-08-05
Duke Scientist Tells Congress Curbing Global Warming Will Prevent 4.5 Million U.S. Deaths - Duke Today,2020-08-05
Japan's climate change efforts hindered by biased business lobby: study - Reuters,2020-08-05
Understanding the impact of climate change on sub-arctic groundwater - Advanced Science News,2020-08-05
How Biden Could Use Trump's Trade War Thumbscrews to Fight Climate Change - Foreign Policy,2020-08-05
"Climate change and disruption of ecosystem affect allergies, respiratory disorders - News-Medical.Net",2020-08-05
Bill Gates claims pandemic's 'misery' will 'happen regularly' if climate change is not stopped - Fox News,2020-08-05
Bill Gates says climate change 'could be worse' than COVID - Business Insider,2020-08-05
Project to transform understanding of effects of climate change on mental health - Imperial College London,2020-08-05
"Japan's climate change efforts hindered by Keidanren bias, study says - The Japan Times",2020-08-05
Rising temps could kill millions a year by century's end - Futurity: Research News,2020-08-05
NRDC Says Climate Change Is Endangering Worker Health and Safety - EHS Daily Advisor - EHS Daily Advisor,2020-08-05
Some Indian states gear up to tackle climate disasters - PreventionWeb,2020-08-05
"Climate change may melt the ""freezers"" of pygmy owls and reduce their overwinter survival - EurekAlert",2020-08-05
NYU Langone Joins U.S. Health Care Climate Council - NYU Langone Health,2020-08-05
"A Perfect Storm: Climate Change, Coronavirus, and Sprawling Factory Farms - Food Integrity Campaign",2020-08-05
Wind farms built on carbon-rich peat bogs lose their ability to fight climate change - The Conversation UK,2020-08-05
Some children find spending time in nature 'distressing' over climate change triggers - Daily Mail,2020-08-05
Climate change and hiking hazards: ticks and poison ivy - KXAN.com,2020-08-05
WORLD VIEW: Climate change is killing the Caribbean one cut after another - Bahamas Tribune,2020-08-05
"China, Climate Change, and COVID-19: An Interview With Kevin Rudd - The Diplomat",2020-08-05
Don’t Downplay the Role of Indigenous People in Molding the Ecological Landscape - Scientific American,2020-08-05
Amazon's emissions increase 15% in 2019 amid efforts to reduce carbon footprint - S&P Global,2020-08-05
Climate change may mean hurricanes hitting Durban – and Transnet wants to be prepared - Business Insider South Africa,2020-08-05
Government’s ‘pitiful’ planning reforms ‘will cost Britain decades in fighting climate change’ - The Independent,2020-08-05
"Climate change WA’s biggest concern post-coronavirus, says former Premier Carmen Lawrence - The West Australian",2020-08-05
How Canada became an environmental outlier - Maclean's,2020-08-05
Bridging the Water Access Gap Through COVID-19 Relief - Center For American Progress,2020-08-05
"Jamaica Leading Global Conversations Towards a Sustainable and Green Recovery after COVID-19 – Jamaica Information Service - Government of Jamaica, Jamaica Information Service",2020-08-05
China's Retrograde Rural Land Policies - Council on Foreign Relations,2020-08-05
Excerpt: Why girls need to speak up and ask for what they deserve - Fast Company,2020-08-05
California Grapples With Toughest Climate Issue Yet: Sprawl - NPR,2020-08-06
"Climate change: How to drive fossil fuels out of the US economy, quickly - Vox.com",2020-08-06
Pa.'s GOP-led legislature not acting on climate change; scientists say clock is ticking - WHYY,2020-08-06
Task Force Brings District Together to Tackle Climate Change - Natural Resources Defense Council,2020-08-06
Climate change to bring longer droughts in Europe: study - Phys.org,2020-08-06
Climate change: UK peat emissions could cancel forest benefits - BBC News,2020-08-06
Future Loss: Grieving A Changing Climate - KALW,2020-08-06
Does Climate Change Top Corporate ESG Agendas in 2020? - CSRwire.com,2020-08-06
How Tropical Storm Isaias is connected to climate change | StateImpact Pennsylvania - StateImpact Pennsylvania,2020-08-06
‘Super-Pollutant’ Emitted by 11 Chinese Chemical Plants Could Equal a Climate Catastrophe - InsideClimate News,2020-08-06
"Beirut, Hong Kong, Climate Change: Your Friday Briefing - The New York Times",2020-08-06
Impact of climate change on tropical fisheries would create ripples across the world - Science Daily,2020-08-06
Climate Change Is a Bigger Disaster Than Coronavirus: Bill Gates - Bloomberg,2020-08-06
What is climate change displacement? A hard look at forced migration - Kulture Hub,2020-08-06
"Washtenaw County sets 2030 carbon-neutral goal, takes ‘biggest step’ yet on climate change - MLive.com",2020-08-06
The Washington Post's 2°C: Beyond the Limit series recognized for Outstanding Explanatory Reporting by the Society of Environmental Journalists - Washington Post,2020-08-06
South Floridians need to elect climate-focused legislators in 2020 | Opinion - Miami Herald,2020-08-06
Cultivating a Healthy Environment for Our Children - On the Pulse,2020-08-06
"In tackling the global climate crisis, doom and optimism are both dangerous traps - The Guardian",2020-08-06
"Harris and Ocasio-Cortez Team up on a Climate ‘Equity’ Bill, Leaving Activists Hoping for Unity - InsideClimate News",2020-08-06
2020 could become one of the hottest years on record - World Economic Forum,2020-08-06
"Harris, Ocasio-Cortez introduce environmental justice bill | TheHill - The Hill",2020-08-06
Trade and climate change increase pest threat to Europe's forests - Phys.org,2020-08-06
Let's hold an election debate solely on climate change - Stuff.co.nz,2020-08-06
Climate change could be worse disaster than coronavirus: Bill Gates - Business Today,2020-08-06
Audubon and ACC Campus Partnership Proves Climate Is Everyone's Issue | Audubon - National Audubon Society,2020-08-06
Supreme Court ruling a turning-point for climate governance in Ireland - The Irish Times,2020-08-06
Bureau of Meteorology: under pressure to toe the Coalition line on climate change? - Michael West News,2020-08-06
Explorer exposes the dramatic impact of global warming - Daily Mail,2020-08-06
"New Documentary Film, ‘Juice,’ Challenges Elitism Of Anti-Growth Environmentalism - Forbes",2020-08-06
Biden's Ambitious Goals for Climate and Agriculture Require Bolder Strategies – Food Tank - Food Tank,2020-08-06
"Frequent tectonic activities, climate change causing landslides in Pithoragarh, say experts - Hindustan Times",2020-08-06
"Judith Collins hails farmers as 'climate change warriors', promises Zero Carbon Act changes - Newshub",2020-08-06
Weather alerts at risk as Kenyan local radio struggles amid virus - Thomson Reuters Foundation,2020-08-06
Climate and the value chain: a roadmap for Scope 3 emissions reductions - edie.net,2020-08-06
Climate change: Lockdown has 'negligible' effect on temperatures - BBC News,2020-08-07
"Yes, Emissions Have Fallen. That Won’t Fix Climate Change - WIRED",2020-08-07
Emissions dropped during the COVID-19 pandemic. The climate impact won’t last - Science News,2020-08-07
"Five Years After Speaking Out on Climate Change, Pope Francis Sounds an Urgent Alarm - InsideClimate News",2020-08-07
"Opinion | I’m a Conservative Christian Environmentalist. No, That’s Not an Oxymoron. - The New York Times",2020-08-07
"In Tackling the Global Climate Crisis, Doom and Optimism are Both Dangerous Traps - Resilience",2020-08-07
Climate change and COVID-19: reinforcing Indigenous food systems - The Lancet,2020-08-07
This worst-case climate scenario might be the most realistic - Popular Science,2020-08-07
Amazon’s Jeff Bezos creates Fellowship Ventures for $10 billion climate change strategy - Vox.com,2020-08-07
Why low-end ‘climate sensitivity’ can now be ruled out - Yale Climate Connections,2020-08-07
Coronavirus: Green recovery 'could prevent 0.3C' of warming by 2050 - Carbon Brief,2020-08-07
Western News - Sparrows' storm stress a harbinger of climate-change impact - Western News,2020-08-07
Planting tiny urban forests can boost biodiversity and fight climate change | Greenbiz - GreenBiz,2020-08-07
Inside Joe Biden's Network of Climate Advisers - Scientific American,2020-08-07
Using Big Data And The Power Of Markets To Solve Climate Change - Forbes,2020-08-07
The Trouble With Climate Scenarios Is Everyone Has Their Own - Bloomberg,2020-08-07
Coronavirus lockdown will have hardly any long-term impact on climate change - Daily Mail,2020-08-07
Covid-19 lockdown will have 'negligible' impact on climate crisis – study - The Guardian,2020-08-07
How to use The Post's climate data analysis - The Washington Post,2020-08-07
Coronavirus lockdown will have 'negligible' impact on the climate – new study - The Conversation UK,2020-08-07
CA cap-and-trade program: Tough on Trump's climate change stance - Daily Californian,2020-08-07
Covid-19 lockdowns will have little lasting impact on global warming - New Scientist News,2020-08-07
Tel Aviv Municipality launches action plan to combat climate change - The Jerusalem Post,2020-08-07
Endangered Species 'Habitat' Proposal Raises Climate Questions - Bloomberg Law,2020-08-07
Nuclear Energy for Non-Electric Applications Key for Climate Change Mitigation - International Atomic Energy Agency,2020-08-07
"On Climate Policy, Biden's Advisers Reveal More Than His Proposals Do - The Intercept - First Look Media",2020-08-07
Commentary: How much will COVID-19 lockdowns slow the effects of climate change? - CNA,2020-08-07
5 lessons from the pandemic to tackle the climate crisis - CNN,2020-08-07
One size does not fit all: different vector-borne diseases impacted differently by climate change - BugBitten - BMC Blogs Network,2020-08-07
COVID-19 recovery choices will shape the future climate as well as economy - Imperial College London,2020-08-07
Comment: Lessons from the plague: An approach to climate change - Times Colonist,2020-08-07
Why New Belgium Is Charging $100 for a Six-Pack of Beer - Outside Magazine,2020-08-07
"The climate crisis: Our children warned us, but we did not listen - Aljazeera.com",2020-08-07
Joe Biden's Evolving Climate Policy - alleghenyfront.org,2020-08-07
"With her exams cancelled, teenager writes study on climate change - The Times",2020-08-07
"Climate change, drop in green cover upping Mumbai’s flood risk - Times of India",2020-08-07
Why deforestation and extinctions make pandemics more likely - Nature.com,2020-08-07
A Warming World - The New York Times,2020-08-07
"Kashmir, Jammu and Ladakh may see temperature rise of 7 degrees by 2100: Study - Hindustan Times",2020-08-07
The trouble with climate scenarios is that everyone has their own - Business Standard,2020-08-07
How Tropical Storm Isaias is connected to climate change - WHYY,2020-08-07
Lockdown emissions fall will have 'no effect' on climate - Phys.org,2020-08-07
Opinion: Data Dive with Nik Nanos: How the pandemic has changed our views on climate change - The Globe and Mail,2020-08-07
Climate change to bring drought to Europe seven times more often - Metro.co.uk,2020-08-07
"Climate Change May Melt 85% Glaciers in J&K, Ladakh; Cause Temp Rise of 6.9 Degree Celsius by 2100: Study - News18",2020-08-07
Climate change is pushing millions of people into cities like Addis Ababa. Here’s what rapid urbanisation looks like in the Ethiopian capital. - Business Insider Australia,2020-08-07
Climate change: A major global threat - Breaking Belize News,2020-08-07
Why New Belgium Brewing is charging $100 for a six-pack of Fat Tire today - Fast Company,2020-08-07
"Alexandria Ocasio-Cortez, Kamala Harris team-up for Climate Equity Bill - AL DIA News",2020-08-07
Record-breaking summers due to climate change 'a danger to human health' - Jersey Evening Post,2020-08-07
"Lockdown climate benefits not lasting, scientists warn - RNZ",2020-08-07
Why climate change is about to make your bad commute worse - The Washington Post,2020-08-08
Study reveals human health impacts of climate change - Earth.com,2020-08-08
This is how lockdown has affected global temperatures - Countryliving (UK),2020-08-08
How the arts might help us grapple with climate change - CBC.ca,2020-08-08
False Alarm by Bjorn Lomborg; Apocalypse Never by Michael Shellenberger – review - The Guardian,2020-08-08
