Title,Date
Priyanka Chopra and Chris Hemsworth come together to help fight climate change around the world - VOGUE India,2020-10-12
I’m an American Climate Emigrant - Sierra Magazine,2020-10-12
Fixing Climate Change Requires Vegan Time Travel—Sort Of - PETA,2020-10-12
How Farmers Are Fighting Climate Change With Sustainability - Business Insider,2020-10-12
IEA outlines how world can reach net zero emissions by 2050 - Climate Home,2020-10-12
Teen climate change activist Greta Thunberg endorses Joe Biden - WJHL-TV News Channel 11,2020-10-12
UN chief urges ministers to provide 'decisive leadership' on climate action - UN News,2020-10-12
"Climate change to reduce solar radiation in hot, arid regions - pv magazine International",2020-10-12
World Food Prize: Al Gore says farmers can make money with practices that sequester carbon - Des Moines Register,2020-10-12
"EU, first climate neutral continent by 2050, needs 60% reduction in emissions by 2030 - Down To Earth Magazine",2020-10-12
TED Talk Proposes A Three-Step Plan for India's Clean Energy Transition - State of the Planet,2020-10-12
Future Act MP held 'climate hysteria skeptics' meetings at high school - The Spinoff,2020-10-12
Business School establishes new Singapore Green Finance Centre - Imperial College London,2020-10-12
How is Climate Change Impacting House Prices? – BRINK – Conversations and Insights on Global Business - BRINK,2020-10-13
UN report: Climate change means more weather disasters every year - PBS NewsHour,2020-10-13
"New poll on climate change: Denial is out, alarm is in. - Grist",2020-10-13
"Volusia-Flagler-St. Johns to be heavily affected by climate change, data predicts - Daytona Beach News-Journal",2020-10-13
What has COVID-19 taught us about tackling climate change? - World Economic Forum,2020-10-13
How California Will Prepare Its Infrastructure for More Climate Catastrophes - Union of Concerned Scientists,2020-10-13
The good and bad of Joe Biden’s $2 trillion climate change plan: Bjorn Lomborg - OCRegister,2020-10-13
Fujitsu pledges to help customers tackle the climate change crisis - ZDNet,2020-10-13
A reelected Trump's climate control - POLITICO - Politico,2020-10-13
American Pikas show resiliency in the face of global warming - Science Daily,2020-10-13
UK's biggest asset manager to warn 500 companies on climate change - Financial Times,2020-10-13
Nitrous oxide emissions are a serious climate problem - Futurity: Research News,2020-10-13
Plastic is the enemy of the environment and fighting climate change | Opinion - Tennessean,2020-10-13
Adapting to 4°C of global warming - GOV.UK,2020-10-13
"Trump administration study finds climate change, oil drilling could threaten polar bears - FOX 5 DC",2020-10-13
Mark Carney says banks should link executive pay to Paris climate goals - The Guardian,2020-10-13
"Salt Lake County signs Utah climate change, pollution compact - Deseret News",2020-10-13
"New global temperature data will inform study of climate impacts on health, agriculture - Science Daily",2020-10-13
"People are fed up with ‘eco-friendly tips’, says new climate study - Euronews",2020-10-13
"Megachurch Pastor Preaches Climate Change Denial, Calls Earth 'Disposable Planet' - Patheos",2020-10-13
How big is the ozone hole over Antarctica? - World Economic Forum,2020-10-13
"Impact of COVID-19 on people's livelihoods, their health and our food systems - World Health Organization",2020-10-13
"Expert says climate bill full of 'weasel words, get-out clauses and loopholes' - Independent.ie",2020-10-13
Climate change hits the poor hardest. Here's how to protect them - World Economic Forum,2020-10-14
How the coronavirus has impacted climate change – for good and bad - New Scientist,2020-10-14
"Restoring Farmland Could Drastically Slow Extinctions, Fight Climate Change - The New York Times",2020-10-14
Evangelical Christians Confront Climate Change : Rough Translation - NPR,2020-10-14
Want to Know More About the Candidates and Climate Change? Read This. - The New York Times,2020-10-14
Data: Climate Change Will Heavily Impact Florida Counties - GovTech,2020-10-14
Amy Coney Barrett at hearing: Climate change is “politically controversial” - Vox.com,2020-10-14
"The best, worst, and weirdest climate ads of 2020 - Grist",2020-10-14
Prime Coalition and other new public charities are pouring money into technology aimed at climate change - The Washington Post,2020-10-14
Is climate change causing more natural disasters? | World Economic Forum - World Economic Forum,2020-10-14
Climate Change Is the Internet's Worst Enemy - Gizmodo,2020-10-14
How the Green New Deal lit a fire under the GOP - Grist,2020-10-14
How Biden would use trade agreements to fight global warming - POLITICO,2020-10-14
The Great Barrier Reef Has Lost Half Its Corals - The New York Times,2020-10-14
Maui Has Begun the Process of Managed Retreat. It Wants Big Oil to Pay the Cost of Sea Level Rise. - InsideClimate News,2020-10-14
"Earth breaks September heat record, may reach warmest year - The Associated Press",2020-10-14
Facebook plans to use AI to help fight climate change - CNET,2020-10-14
Climate change undermines the safety of buildings and infrastructure in Europe - Phys.org,2020-10-14
"For Decades, the GOP Has Fought Against Climate Action. 'Eco-Right' Groups Are Working to Change the Conversation - Morning Consult",2020-10-14
The Basel Committee's initiatives on climate-related financial risks - bis.org,2020-10-14
Democrats Should Stop Worrying About Debating Climate Change - The Nation,2020-10-14
The Covid-19 Era Sheds Light On Transportation’s Climate Change Impact - Forbes,2020-10-14
How 'The Ministry for the Future' creates a blueprint for fighting climate change - EW.com,2020-10-14
Wildfires show how climate change is transforming national parks - National Geographic Traveler Magazine,2020-10-14
Virtual Highland climate change conference to be held in November - RossShire Journal,2020-10-14
The Future of Carbon Capture and the Fight Against Climate Change - AZoCleantech,2020-10-14
Firefighters are paying the price of climate denial - Los Angeles Times,2020-10-14
Telangana's heavy showers have sure shot imprint of climate change - Down To Earth Magazine,2020-10-14
Influential academics reveal how China can achieve its 'carbon neutrality' goal - Carbon Brief,2020-10-14
How quickly are Antarctica's glaciers melting? - World Economic Forum,2020-10-14
Amy Coney Barrett refuses to tell Kamala Harris if she thinks climate change is happening – video - The Guardian,2020-10-14
Temperatures of deepest ocean rising quicker than previously thought - The Guardian,2020-10-14
Barrett calls climate change a 'contentious matter of public debate' - Washington Post,2020-10-14
The CEO of Boston Consulting Group on Addressing Climate Change - Business Insider,2020-10-14
Czechs drop opposition to 2030 climate goal ahead of EU summit - EURACTIV,2020-10-14
GIC looks to integrate climate change into all investment processes - Business Times,2020-10-14
The publicly-funded climate resilience projects that might actually make the problem worse - Stuff.co.nz,2020-10-14
"All about La Niña, reason why India could have a colder winter than usual this year - ThePrint",2020-10-14
"Daily Update: October 14, 2020 - S&P Global",2020-10-14
Climate change is not a priority to most companies. Here’s how to hold them accountable. - Vox.com,2020-10-15
How is climate change affecting the Atlantic Ocean? | World Economic Forum - World Economic Forum,2020-10-15
Climate change resources for people who dispute climate science - Mashable,2020-10-15
China’s climate change researchers have a plan to radically reduce emissions by 2050 - Vox.com,2020-10-15
Are climate scientists being too cautious when linking extreme weather to climate change? - UW News,2020-10-15
"Climate change offers opportunity for cooperation, innovation, and leadership in Coastal Georgia - Savannah Morning News",2020-10-15
What Are The Presidential Candidates' Views On Climate Change? - NPR,2020-10-15
These youth hold a secret weapon against climate change | Greenbiz - GreenBiz,2020-10-15
Climate change is wreaking havoc on the power grid in ways you never knew - Los Angeles Times,2020-10-15
"As Climate Change Worsens, How Far Will We Tip? - Fair Observer",2020-10-15
Idris Elba: We can all help solve climate change - BBC News,2020-10-15
"Climate change likely drove early human species to extinction, modeling study suggests - Science Daily",2020-10-15
Climate change may have driven early human species to extinction - New Scientist News,2020-10-15
Building long-term resilience to climate change in California - CALmatters,2020-10-15
How a Climate Corps Could Put Youth to Work in Greening America - Yale Environment 360,2020-10-15
Are Corals Genetically Prepared for Climate Change? - Technology Networks,2020-10-15
How Religion Influences Our Relationship With the Environment - State of the Planet,2020-10-15
Climate change may one day shut down Yellowstone's Old Faithful | TheHill - The Hill,2020-10-15
"Dana Balter and John Katko, on the issues: Climate change - Auburn Citizen",2020-10-15
Editorial: Climate change is a constant problem - Maroon,2020-10-15
Why a Historic Emissions Drop from COVID Is No Cause to Celebrate - Scientific American,2020-10-15
Stalling hurricanes like Sally may be linked to climate change - al.com,2020-10-15
India: Air Quality and Health Risks from Climate and COVID19 - NRDC (Natural Resources Defense Council),2020-10-15
Climate Change Has Killed Half of the Great Barrier Reef's Corals - Smithsonian Magazine,2020-10-15
"Introducing Planet, The Atlantic’s new section - The Atlantic",2020-10-15
"The left’s belated, and bittersweet, victory on climate change - Aljazeera.com",2020-10-15
"Ships to get free pass on emissions until 2030, under compromise proposal - Climate Home",2020-10-15
Climate warming is altering animals' gut microbes — and affecting their ability to survive and thrive | Greenbiz - GreenBiz,2020-10-15
California's Failed Climate Change Policy - RealClearEnergy,2020-10-15
What is an IPCC report? - Yale Climate Connections,2020-10-15
"‘How It Started, How It’s Going’: WWF Uses Meme to Highlight Climate Change - Motherboard",2020-10-15
Climate Change Could Shift Pennsylvania Wildfire Season - alleghenyfront.org,2020-10-15
Green Republican Trammell S. Crow on Reshaping US Politics to Solve Climate Change - Greentech Media News,2020-10-15
Nearly Half of the U.S. Is in Drought. It May Get Worse. - The New York Times,2020-10-15
Factbox: The road to Europe's new climate change target - Reuters,2020-10-15
Flooded Asia: Climate change hits region the hardest - Financial Times,2020-10-15
"Europe's green tech key to climate change fight, Belgium says - Reuters",2020-10-15
The CO2 market failure: it's free to emit but has costly consequences - USAPP American Politics and Policy (blog),2020-10-15
How do we raise kids to deal with a changing climate? - ABC Life,2020-10-15
Vietnam inspires the world in climate change response - http://en.vietnamplus.vn/,2020-10-15
COVID-19 could distract the world from even greater threats - World Economic Forum,2020-10-15
Biden is the obvious 'climate choice' candidate in the current race | TheHill - The Hill,2020-10-15
"Ask Ethan: Will Earth’s Temperature Start Decreasing Over The Next 20,000 Years? - Forbes",2020-10-15
Capitalism Caused Climate Change; It Must Also Be the Solution - BloombergQuint,2020-10-15
"European Council conclusions on COVID-19 and climate change, 15 October 2020 - EU News",2020-10-15
How defence is rising to the sustainability challenge - GOV.UK,2020-10-15
G20 and climate action post-Covid - Observer Research Foundation,2020-10-15
Divestment Campaigns Move Beyond Oil - The Wall Street Journal,2020-10-15
Africa's largest dam fills Ethiopia with hope and Egypt with dread - Washington Post - The Washington Post,2020-10-15
Survey: Virginians seeking out news about climate change and solutions - Energy News Network,2020-10-16
US House candidates on the issues: Climate change - Shawnee Mission Post,2020-10-16
"Trump Vs. Biden On Environmental Policy, Climate Change - NPR",2020-10-16
How one of the world’s biggest banks plans to tackle climate change - Fortune,2020-10-16
How Americans Feel About Climate Change And Disasters That Affect The U.S. - NPR,2020-10-16
Climate Change Makes a (Very) Brief Appearance in Dueling Town Halls Held by Trump and Biden - InsideClimate News,2020-10-16
'It Needs to Stop.' Harrison Ford Speaks Out Against Leaders Who Politicize Climate Change - TIME,2020-10-16
Fact check: Video presents climate change statements that lack key context - Reuters,2020-10-16
"Climate Change Brings up Some Hard Emotions, but There Can Be Joy in the Struggle - alleghenyfront.org",2020-10-16
Climate Change Is Hampering Our Ability To Combat World Hunger - Inkstick,2020-10-16
EarthBeat Weekly: There's still time to act on climate change - National Catholic Reporter,2020-10-16
New Climate Warnings in Old Permafrost: ‘It’s a Little Scary Because it’s Happening Under Our Fee... - InsideClimate News,2020-10-16
"Sick cows release more methane, increasing ghg emissions - Anthropocene Magazine",2020-10-16
"Even if deniers don't, Florida insurers recognize the cost of climate change | Fred Grimm - South Florida Sun Sentinel",2020-10-16
"Supreme Court Nominee Barrett Resisted Climate Science, but Other Judges Have Embraced It - Scientific American",2020-10-16
Casey says mitigating climate change should be political priority - Pittsburgh Post-Gazette,2020-10-16
'Eat less meat to help the climate' doesn't apply to everyone – here's why - DW (English),2020-10-16
Expert: Beware Of Simple Solutions - Tree Planting Won’t Solve Climate Change - Forbes,2020-10-16
The IMF Has a Blueprint for Helping the Climate Without Hurting Economic Growth - Bloomberg,2020-10-16
ExxonMobil misled the public about the climate crisis. Now they're trying to silence critics - The Guardian,2020-10-16
"In Israel, some animals are thriving in climate change - Ynetnews",2020-10-16
Urumangi Generation explores 'Indigenous resiliency' and climate change in a cyberpunk setting - CBC.ca,2020-10-16
Climate Change May Wipe Out Yellowstone’s Old Faithful - Nerdist,2020-10-16
Less than a third aware that wasting food contributes to climate change - Circular Online,2020-10-16
Survival of the Fittest? Climate Change Led to Extinction of 'Other' Human Species - News18,2020-10-16
Irreversible Changes Noticed in Asian Ecosystem Due to Climate Change - AZoCleantech,2020-10-16
Jonathan Wilkinson on Canada’s big new climate change plan - Maclean's,2020-10-16
Fears of a climate in crisis: How UNO students can make change for the future of the planet - Gateway - The Gateway,2020-10-16
'My method's an addition to the knowledge about climate change ending the Indus Valley Civilisation' - Down To Earth Magazine,2020-10-16
World's greatest mass extinction triggered switch to warm-bloodedness - Phys.org,2020-10-16
How Should the Media Talk About Climate Change? - The New Yorker,2020-10-17
"Human-driven climate change is changing the colors of fall foliage, scientists say - The Washington Post",2020-10-17
China As Climate Change Savior: The Triumph Of Hope Over Experience? - Forbes,2020-10-17
"New South Florida Climate Change Financial Report: Spend Billions Or Lose Much, Much More - WUSF News",2020-10-17
Could moths be the secret to understanding climate change? - Euronews,2020-10-17
"David Attenborough, Why Did It Take You So Long? - Sierra Magazine",2020-10-17
"Greta Thunberg tells ITV News: 'World's focus should be on climate change, not me' - ITV News",2020-10-17
Republicans And Democrats Can Agree When It Comes To Climate Change - Forbes,2020-10-18
Alaska's new climate threat: tsunamis linked to melting permafrost - The Guardian,2020-10-18
High stakes for Earth's climate future in US vote - EURACTIV,2020-10-18
"Between Covid, climate change and the budget, no wonder many women are rethinking having babies - The Guardian",2020-10-18
Climate change effects on coral reproduction - The Statesman,2020-10-18
Climate Change: It's our choice whether we react or adapt - Stuff.co.nz,2020-10-18
Climate change: Why some New Zealanders still deny it's happening - New Zealand Herald,2020-10-18
Fort Worth is ready to vote. Are the people running the election up to the task? - Fort Worth Star-Telegram,2020-10-18
Climate Migration and Cities: Preparing for the Next Mass Movement of People - New Security Beat,2020-10-19
This is how universities can lead climate action - The Conversation AU,2020-10-19
Op-ed: Climate change threatens U.S. banks far more than they're disclosing - CNBC,2020-10-19
Bill Gates reveals details of his upcoming climate change book - CNET,2020-10-19
Let scientists guide us in the fight against climate change - EURACTIV,2020-10-19
This company thinks its plastic alternative can help solve climate change - CNN,2020-10-19
US election 2020: What the results will mean for climate change - BBC News,2020-10-19
Oxfam: Rich countries are not delivering on $100bn climate finance promise - Climate Home,2020-10-19
Today's wildfire modeling 'just sucks' for flames fueled by climate change - High Country News,2020-10-19
Tiny beetles a bellwether of ecological disruption by climate change - CU Boulder Today,2020-10-19
Music and climate change: six of the best pieces of music responding to the climate crisis - Classical-Music.com,2020-10-19
"China hits out at US climate record, in pointed message ahead of election - Climate Home",2020-10-19
Guest post: Demand for cooling is blind spot for climate and sustainable development - Carbon Brief,2020-10-19
"Bears, bison and wolves: Rewilding Romania to better cope with climate change - Euronews",2020-10-19
Study Shows Climate Change Might Impact Sunbelt Cities Harder Than Once Thought - KJZZ,2020-10-19
Netflix documentaries show climate change in an upsettingly all too realistic focus - Hospitality & Catering News,2020-10-19
"Climate change has killed half of the Great Barrier Reef's corals, study finds - FOX 5 DC",2020-10-19
California officials see boon in Joe Biden's climate plan - Los Angeles Times,2020-10-19
What No COVID Risk? No Climate Change? How To Overcome Toxic Denial - Forbes,2020-10-19
Opinion | Could Fracking Actually Help the Climate? - POLITICO,2020-10-19
We could slow climate change by dimming the sun. But should we? - Digital Trends,2020-10-19
EU Will Drive Climate Disclosure Regulation Much Like GDPR - Bloomberg Law,2020-10-19
How China could be carbon neutral by mid-century - Nature.com,2020-10-19
Climate Change Will Make Anomalous Flooding in India's Urban Sprawls the Norm - The Wire Science,2020-10-19
"As climate change begins to bite, ending overfishing will safeguard our oceans’ health ǀ View - Euronews",2020-10-19
Climate scientists fly more than other academics despite global warming fears - iNews,2020-10-19
What is the Green Deal? - POLITICO.eu,2020-10-19
Expert Says American Pikas Are More Climate-Resilient Than Many Think - KJZZ,2020-10-19
Excerpt: David Miller’s ‘Solved: How the World’s Great Cities Are Fixing the Climate Crisis’ - TVO,2020-10-19
I Fully Converted a Home to Electricity. Here’s How It Worked — and What It Cost - Greentech Media News,2020-10-19
OP-ED: Reimagining the Cross Bronx Expressway as a high capacity transit corridor - MassTransitMag.com,2020-10-19
Why Are Renewable Resources More Expensive? - Green Matters,2020-10-19
10 bellwether counties that could signal where the election is headed | TheHill - The Hill,2020-10-19
Climate Superpowers Could Alter Foreign Policy Landscape - New Security Beat,2020-10-20
Tackling climate change seemed expensive. Then COVID happened. - Grist,2020-10-20
House Introduces Sweeping Legislation to Tackle Climate Change on Our Coasts - National Audubon Society,2020-10-20
"Climate change is affecting Wisconsinites' health, new UW study finds - UW Badger Herald",2020-10-20
Cooling: The hidden threat for climate change and sustainable goals - Phys.org,2020-10-20
"To tell the story of climate change, we went beyond the beach. Here’s how we did it. - Raleigh News & Observer",2020-10-20
What cold lizards in Miami can tell us about climate change resilience - Phys.org,2020-10-20
Giants of Madagascar Driven to Extinction by Humans and Climate Change - SciTechDaily,2020-10-20
Can governments use COVID-19 to help battle climate change? - World Economic Forum,2020-10-20
Experts say climate change is causing record high flooding during king tides - Palm Beach Post,2020-10-20
Govt aims to honour climate change pact - Bangkok Post,2020-10-20
"Climate policy, environmental justice, and local air pollution - Brookings Institution",2020-10-20
"Climate scientists fly more than other researchers, first global study suggests - Phys.org",2020-10-20
OUR VIEW: Siesta Key hotel projects should be viewed through the prism of climate change - Sarasota Herald-Tribune,2020-10-20
"For Many Colorado Voters, Climate Is Personal And Pushing Them At The Polls - Colorado Public Radio",2020-10-20
Luxury Daily - Luxury Daily,2020-10-20
Mississauga Launches Virtual Challenge to Encourage Youth to take Action on Climate Change - City of Mississauga,2020-10-20
Queensland 2030 climate target would be scrapped if LNP win election as state’s emissions rise - The Guardian,2020-10-20
What's the Big Fuss about Climate Change Anyway? - The Humanist,2020-10-21
Climate change: Is air conditioning bad for the environment? - World Economic Forum,2020-10-21
How escalating climate change fuels California's infernos - Washington Post - Washington Post,2020-10-21
"Climate change in Wisconsin will have severe health impacts, report says - Wisconsin Examiner",2020-10-21
It's about time adults start rising up against climate change - Popular Science,2020-10-21
"Climate change poses water risks to nuclear, fossil-fueled plants - S&P Global",2020-10-21
Climate change is not political - Martha's Vineyard Times,2020-10-21
Climate change advocacy continues despite lack of federal progress - UW Badger Herald,2020-10-21
Bill Proposes Harnessing Ocean's Power To Help Reverse Climate Change - WUSF News,2020-10-21
A new generation is making climate change a local election issue - National Catholic Reporter,2020-10-21
"Novelist Sigrid Nunez On Climate Change, Mortality And Life In A Pandemic - NPR",2020-10-21
Pledges and progress: Steps toward greenhouse gas emissions reductions in the 100 largest cities across the United States - Brookings Institution,2020-10-21
A Chicago-based exhibition emphasizes the need for local climate change solutions - Medill Reports Chicago - Medill Reports: Chicago,2020-10-21
How the youth climate movement is influencing the green recovery from COVID-19 - The Conversation UK,2020-10-21
Biden puts climate change at center of his campaign. Here's what it could mean for Indiana. - IndyStar,2020-10-21
Government aims to make Germany climate resilient as average temperature rises - Clean Energy Wire,2020-10-21
Student scientists work to help all of us survive a warmer world - Science News for Students,2020-10-21
Putting giant blankets on the Alps or firing sulphur skywards are the latest form of climate change denial - iNews,2020-10-21
Worried about bringing kids into the world? Here's a sneak peak at what their future might look like - ABC News,2020-10-21
EVs alone aren't enough to meet climate-change targets - The Globe and Mail,2020-10-21
Can US Lawmakers Agree on Big Climate and Clean Energy Legislation? - Greentech Media News,2020-10-21
"Climate change will bring more record-breaking UK rainfall and scorching temperatures, Met Office says - iNews",2020-10-21
Morrison government 'ignored' Climate Change Authority's advice on Covid recovery - The Guardian,2020-10-21
Indigenous food insecurity driven by climate change: report - The Narwhal,2020-10-21
The link between education and support for climate change is weaker among right-wing ideologists in developed countries - PsyPost,2020-10-21
School kids to become climate change reporters in Sky programme - iNews,2020-10-21
Top 5 Countries in Asia Pacific Most Affected by Climate Change - ValueChampion,2020-10-21
Shawn Vestal: Silence becomes the new style of denial on climate - The Spokesman-Review,2020-10-21
Climate Bill criticised for lack of accountability and sanctions - The Irish Times,2020-10-21
UK to host crucial climate change conference ´COP26´ - Kenya Broadcasting Corporation,2020-10-21
FROM THE FIELD: Women guardians of the environment - UN News,2020-10-21
Mountain West In Climate Crosshairs As 2020 Heats Up - KUNR Public Radio,2020-10-21
"Planet 'in peril' due to climate change, says Michael D Higgins - Irish Examiner",2020-10-21
How much meat should I be eating? - Greenpeace UK,2020-10-21
Detroit Is THIS Podcast: Jan Peelen Shares Insight on Urban Planning and Smart Cities - Detroitisit,2020-10-21
"Cities are pledging to confront climate change, but are their actions working? - Brookings Institution",2020-10-22
Experts call for climate change debate to move beyond settled science and focus on action - ABC News,2020-10-22
Trump And Biden Could Not Be Further Apart On Climate Change - NPR,2020-10-22
"Hurricanes, wildfires and other extreme weather are linked to global warming - The Washington Post",2020-10-22
"Want to stop climate change? Look to farms, forests and wetlands - Los Angeles Times",2020-10-22
Biden and Trump lay out starkly different visions on climate change in final presidential debate - The Washington Post,2020-10-22
ExxonMobil Claims Shift on Climate But Continues to Fund Climate Science Deniers - Union of Concerned Scientists,2020-10-22
"Ahead of US election, Europe eyes an ally in climate change fight - Al Jazeera English",2020-10-22
Denver's unique sales tax to fight climate change could be a blueprint for future action nationwide - The Colorado Sun,2020-10-22
