Title,Date
U.S. CEO group says it supports carbon pricing to fight climate change - Reuters,2020-09-16
"Getting to net zero emissions could cost $2 trillion a year, report says - CNN",2020-09-16
Sports are impacted by climate change—but can help tackle it - Fast Company,2020-09-16
Pro-lifers should be concerned about climate change | Opinion - The Philadelphia Inquirer,2020-09-16
"Trump's plan for managing forests won't save us in a more flammable world, experts say - The Washington Post",2020-09-16
Chimpanzees evolved to behave more flexibly. It can help them weather climate change - Down To Earth Magazine,2020-09-16
Praying for climate change isn't enough. It's time for people of faith to act - The Arizona Republic,2020-09-16
Study: Climate Change Is Altering Water Flow In The Hindu Kush Himalayan Region - Forbes,2020-09-16
The megafires and pandemic expose the lies that frustrate action on climate change | Tim Flannery - The Guardian,2020-09-16
Glenwood Canyon Is Exhibit A For The Risk Climate Change Poses To The Country's Infrastructure - Colorado Public Radio,2020-09-16
Greenpeace targets Spain with climate change lawsuit - EURACTIV,2020-09-16
A new book calls on Canadians to mobilize for the climate crisis like World War II - Maclean's,2020-09-16
"Less ice, more rain... Why a new Arctic climate can be a global watershed - Down To Earth Magazine",2020-09-16
"Climate policies, curbs on oil drilling central to Ventura County's adopted General Plan - VC Star",2020-09-16
South Africa aims to reach net zero emissions in 2050 - while still burning coal - Climate Home,2020-09-16
'Sub-Saharan Africa most vulnerable to climate change' - Anadolu Agency,2020-09-16
California governor emphasizes wildfires show reality of climate change - CNN,2020-09-16
West Nile Virus Transmission May Shift Due to Climate Change - Genetic Engineering & Biotechnology News,2020-09-16
'A dose of reality': Morrison government's new $1.9 billion techno-fix for climate change is a small step - The Conversation AU,2020-09-16
Biden and Harris' Tweets About the Climate Crisis and Wildfires - Green Matters,2020-09-16
How fertiliser is making climate change worse - BusinessLine,2020-09-16
How to reverse global wildlife declines by 2050 - Down To Earth Magazine,2020-09-16
Coffee Rust Is Going to Ruin Your Morning - The Atlantic,2020-09-16
Plug-in hybrids are a 'wolf in sheep's clothing' - BBC News,2020-09-16
[OPINION] Is the Philippines on track for sustainable development? - Rappler,2020-09-16
The pandemic didn't solve climate change. This week's disasters are proof - CNN,2020-09-17
Perspective | Stopping climate change could cost less than fighting covid-19 - The Washington Post,2020-09-17
Montana Steps Toward Action on Climate Change - NRDC (Natural Resources Defense Council),2020-09-17
Climate change is dumping record amounts of rain. We're not equipped to handle it. - Environmental Defense Fund,2020-09-17
Business and climate change: The great disrupter - The Economist,2020-09-17
Climate change impacts astronomical observations - Science Daily,2020-09-17
"Former climate change denier says ""it's insane to play dice with the planet"" - CBS News",2020-09-17
California Wildfires and the Politics of Climate Change - The Atlantic,2020-09-17
Vulnerable Kansas bird populations are a canary in a coal mine for climate change - USA TODAY,2020-09-17
Perspective | This is how we know climate change is making wildfires worse - The Washington Post,2020-09-17
Deep-Ocean Oxygen May Increase with Climate Change - Eos,2020-09-17
"As wildfires rage, Pennsylvania and 3 other states don't teach about climate change - The Morning Call",2020-09-17
"Senate 2020: In Alabama, Two Very Different Views on Climate Change Give Voters a Clear Choice - InsideClimate News",2020-09-17
Dual disasters: How is climate change worsening wildfires and hurricanes? - USA TODAY,2020-09-17
New estimates for the rise in sea levels due to ice sheet mass loss under climate change - Science Daily,2020-09-17
Webinar: Do we need to stop eating meat and dairy to tackle climate change? - Carbon Brief,2020-09-17
The Age of Megafires: The World Hits a Climate Tipping Point - Yale Environment 360,2020-09-17
Doctors Call For More Training to Respond to Climate Change - Verywell Health,2020-09-17
Belgium's iconic beer and fries threatened by climate change effects - EURACTIV,2020-09-17
Sen. Lindsey Graham once was seen as a progressive on climate change. What happened? - The State,2020-09-17
Best Books on Climate Change and the Environment - The Daily Beast,2020-09-17
"Megafires: Climate change or land management? Unfortunately, both - Nevada Today",2020-09-17
Climate change threatens Komodo dragons - Phys.org,2020-09-17
A Climate Center on Governors Island Is Just What New York Needs - The New York Times,2020-09-17
Newsom promised 'giant leaps' on climate. Will they happen? - Los Angeles Times,2020-09-17
East to get warmer as Ireland's climate to change dramatically by 2050 - The Irish Times,2020-09-17
"Communities facing conflict, climate change and environmental degradation walk a tightrope of survival - World - ReliefWeb",2020-09-17
How to Get Everyone Fighting Climate Change By Buying New Cars - Ward's Auto,2020-09-17
"A Nobel for Thunberg? In the age of climate change and virus, it is possible - Reuters",2020-09-17
Climate risk: What accountants need to know - INTHEBLACK,2020-09-17
"Bill Gates on Coronavirus Vaccines, Climate Change, and Elon Musk and Steve Jobs - Bloomberg",2020-09-17
Global Temperatures To Rise To Levels Not Seen In 50 Million Years By 2300 - Green Queen Media,2020-09-17
"Climate 2020: The good, the bad and the OMG - Street Roots News",2020-09-17
Fast Climate Responses to Aerosol Emission Reductions During the COVID‐19 Pandemic - Wiley,2020-09-17
Legal risks: Guilty by emission - The Economist,2020-09-17
"Viet Nam's 2020 NDC Clarifies Loss and Damage, Outlines Contribution to SDGs 13, 11, 12 | News | SDG Knowledge Hub | IISD - IISD Reporting Services",2020-09-17
4 ways the Middle East can catch up on climate action - World Economic Forum,2020-09-17
Physical impact A grim outlook - The Economist,2020-09-17
Climate change: Earthquake 'hack' reveals scale of ocean warming - BBC News,2020-09-17
Seeking refuge in the climate emergency | Penn Today - Penn Today,2020-09-17
Opening remarks at the press conference on the 2030 climate - EU News,2020-09-17
SOUTH AFRICA: The government has its plan to fight climate change - AFRIK 21,2020-09-17
Leader Column: We now have a portfolio dedicated fighting climate change - Exeter City Council,2020-09-17
Ben & Jerry's pushes climate change message with renamed flavour - The Grocer,2020-09-17
Rewilding: Doubling Britain's woodland cover over the next decade - World Economic Forum,2020-09-17
"Most people in Arizona want government to act on climate change, poll finds - The Arizona Republic",2020-09-18
Column: Fighting climate change - Gaston Gazette,2020-09-18
Opinion | Every Place Has Its Own Climate Risk. What Is It Where You Live? (Published 2020) - The New York Times,2020-09-18
"As wildfires rage, climate experts warn: The future we were worried about is here - NBC News",2020-09-18
"What scares Pa. teens about climate change and how do they want to fight back, a year after massive global protests? | Opinion - The Philadelphia Inquirer",2020-09-18
Climate Scientists Take Their Closest Look Yet at the Warming Impact of Aviation Emissions - InsideClimate News,2020-09-18
Former F1 champion Nico Rosberg calls for governments to 'up their game’ on climate change - CNBC,2020-09-18
The business of climate change - The Economist,2020-09-18
New IAEA Publication Illustrates Nuclear Power's Vital Role in Mitigating Climate Change | IAEA - International Atomic Energy Agency,2020-09-18
"In COVID-19 response, make climate change priority - Devex",2020-09-18
Earthbeat Weekly: What's one thing we can all do about climate change? Talk about it - National Catholic Reporter,2020-09-18
"Opinion | Climate change is killing the farm belt. With a little help, farmers can fix it. - The Washington Post",2020-09-18
Political division makes the fight against climate change ever harder - Financial Times,2020-09-18
"Senate 2020: With Record Heat, Climate is a Big Deal in Arizona, but It May Not Sway Voters - InsideClimate News",2020-09-18
Climate change: Facebook unveils Climate Science Information Center - Smart Energy,2020-09-18
"New poll shows Hoosiers prioritize the environment over the economy, even among Republicans - IndyStar",2020-09-18
Climate change is key factor behind California wildfires - AFP Factcheck,2020-09-18
Why Coal Country Now Says Climate Change Is A Threat And What It Plans To Do About It - Forbes,2020-09-18
Readers call for practical climate-change solutions - Los Angeles Times,2020-09-18
"Amid Brutal Natural Disaster Season, Nearly 3 in 4 Adults Say Climate Change Is Playing a Role - Morning Consult",2020-09-18
Bill Gates says climate change will be as deadly as coronavirus by 2060 - India Today,2020-09-18
"Climate change in mind, Wall Street to start trading a new commodity: Water - Business Standard",2020-09-18
New Zealanders rank climate change above Covid this election - The Guardian,2020-09-18
"Melting glacier floods Arctic coal mine, highlighting climate change irony - Phys.org",2020-09-18
Citizens' assembly: what we've learned about the kind of climate action the public wants to see - The Conversation UK,2020-09-18
"Online Training Course & Workshop: An Introduction to Climate Change: Science, Politics and Impacts - Centre for Science and Environment",2020-09-18
Climate crisis: news outlets still giving a platform to dangerous and outdated views - The Conversation UK,2020-09-18
Ireland's climate likely to drastically change by 2050 - The Green News,2020-09-18
"The pandemic has hurt Canada’s climate change plan. Now we need to get ‘aggressive,’ Ottawa says - Toronto Star",2020-09-18
The tipping points at the heart of the climate crisis - The Guardian,2020-09-19
Business and climate change | Sep 19th 2020 - The Economist,2020-09-19
Asia Heats Up: When Global Warming Becomes Deadly | The Longest Day | Climate Change - CNA Insider,2020-09-19
Underwater and on fire: US climate change magnifies extremes - Tampa Bay Times,2020-09-19
"Climate change, Covid – our hearts ache. But a new era is possible. We can do it - The Guardian",2020-09-19
Students expect universities to do more on climate change - Times Higher Education (THE),2020-09-19
Editorial: Effects of climate change will only get worse - Riverhead News Review - Riverhead News Review,2020-09-19
Can California Gov. Gavin Newsom take on climate change? - Sacramento Bee,2020-09-19
The Space Force's relevance to the green agenda | TheHill - The Hill,2020-09-19
Sink Or Swim? Asia's Sinking Villages Engulfed By Rising Seas | The Longest Day | Climate Change - CNA Insider,2020-09-19
Glenwood Canyon is exhibit A for the risk climate change poses to the country’s infrastructure - 9news.com,2020-09-19
Climate change not only cause of massive wildfires - Boston Herald,2020-09-19
Capturing the Faces of Climate Migration - The New York Times,2020-09-19
"Opinion | After Fire and Floods, Glimmers of Hope - The New York Times",2020-09-19
'A new Arctic.' Global warming shifts the North's entire climate - Cabin Radio,2020-09-19
"'New Normal' Climate, Wildfires Prompt Longtime Californians to Consider Leaving - CBS San Francisco",2020-09-19
The U.S. military is terrified of climate change. It's done more damage than Iranian missiles. - NBC News,2020-09-20
How Maine's US Senate candidates differ on climate change and the environment - Bangor Daily News,2020-09-20
"Climate Change, Bad Forestry and Wildfires - Wall Street Journal",2020-09-20
"Climate Week: World split on urgency of tackling rising temperatures, poll suggests - BBC News",2020-09-20
Geoengineering Is the Only Solution to Our Climate Calamities - WIRED,2020-09-20
Scientists see signs of chimpanzees being able to adapt to climate change - ABC News,2020-09-20
UC Davis researchers working on combating climate change - ABC10.com KXTV,2020-09-20
John Kerry takes the climate change fight to Wall Street - BetaBoston,2020-09-20
Douglas: We can't afford to deny climate change any longer - Akron Beacon Journal,2020-09-20
Famed NYC clock is counting down to Earth's climate change 'deadline' - Mashable,2020-09-20
"World's richest 1% cause double CO2 emissions of poorest 50%, says Oxfam - The Guardian",2020-09-20
"Our View of Space Is Becoming Blurrier as Our Planet Heats Up, Astronomers Warn - ScienceAlert",2020-09-20
Climate change is burning up the U.S. - Campus Times,2020-09-20
"Climate issues confront Arizona, but aren't always raised in McSally-Kelly Senate race - The Arizona Republic",2020-09-20
New SME Climate Hub to make climate action simple for small business - ICC - International Chamber of Commerce,2020-09-20
The president says the climate is about to get cooler | Editorial - Tampa Bay Times,2020-09-20
What are the challenges in saving the planet? | World Economic Forum - World Economic Forum,2020-09-20
Climate Change May Affect Dengue and Malaria Disease Risks - VOA Learning English,2020-09-20
Poland's coal dependency hampers climate change efforts - CNN,2020-09-20
The Gray Market: Why Wildfires and Extreme Weather Will Only Worsen Inequities in the Art World (and Other Insights) - artnet News,2020-09-20
Food and climate change; the impact | The New Times | Rwanda - The New Times,2020-09-20
One Hot Minute: 'I was living my life like I didn't believe in climate change' - scientist Shaun Hendy - Stuff.co.nz,2020-09-20
New Coalition Releases West Virginia Guide On Climate Change - West Virginia Public Broadcasting,2020-09-21
Climate change clock: Metronome in NYC counting down to climate disaster - The Washington Post,2020-09-21
Climate Change Will Restructure the Economy. Here's How Banks Can Prepare. - BRINK,2020-09-21
"Military-style Marshall Plan needed to combat climate change, says Prince Charles - Reuters",2020-09-21
How Movies Like Black Panther Can Help Climate Change - TIME,2020-09-21
Noam Chomsky’s Climate Crisis and the Green New Deal takes on capitalism and politics - Vox.com,2020-09-21
Two American Crises: The Parallels Between Climate Change And The Pandemic - Here And Now,2020-09-21
Trump's energy secretary questions mainstream science on human impacts of climate change | StateImpact Pennsylvania - StateImpact Pennsylvania,2020-09-21
Where Climate Change Is Reality: Supporting Africa's Sahel Pastoralists to Secure a Resilient Future - World Bank Group,2020-09-21
Warlike: Prince Charles Calls For ‘Marshall Plan’ To Fight Climate Change - Forbes,2020-09-21
What's the Most Impactful Thing You Can Do to Combat Climate Change? - Morningstar.com,2020-09-21
"States are doing what big government won't to stop climate change, and want stimulus funds to help | StateImpact Pennsylvania - StateImpact Pennsylvania",2020-09-21
Forest margins may be more resilient to climate change than previously thought - Penn State News,2020-09-21
How Fruit Flies Keep Up With Climate Change - Technology Networks,2020-09-21
A Florida panther sculpture melts before visitors' eyes to highlight the effects of climate change - CNN,2020-09-21
A long-term battle: The tech industry's role in combatting climate change - ZDNet,2020-09-21
Guest post: Calculating the true climate impact of aviation emissions - Carbon Brief,2020-09-21
Why ‘All We Can Save’ Will Make You Feel Hopeful About the Climate Crisis - Rolling Stone,2020-09-21
I'm 18 and can already see my Alaska community changed forever by climate change - The Guardian,2020-09-21
Newsom wants to step up climate fight as wildfires rage. But will Californians pay up? - Sacramento Bee,2020-09-21
"Coffee rust, climate exodus, green recovery: 3 stories you may have missed - Conservation International",2020-09-21
Balancing Worldviews: Climate Change Solutions in Canada's North - The Arctic Institute,2020-09-21
Climate change? U.S. oil giants are doubling down on fossil fuels. - The New York Times,2020-09-21
'Our house is burning': student climate protesters urge their universities to go carbon neutral - The Guardian,2020-09-21
Young Republican Climate Activists Split Over How to Get Their Voices Heard in November’s Election - InsideClimate News,2020-09-21
Doctors Push For Health Care To Address Climate Change In New Teaching Framework - Here And Now,2020-09-21
"Fierce, frequent, climate-fueled wildfires may decimate forests worldwide - Reuters UK",2020-09-21
Meet the doomers: why some young US voters have given up hope on climate - The Guardian,2020-09-21
"Climate Change is Making Fishes and Reptiles Age Faster, Cutting Their Lives Shorter: Study | The Weather Channel - Articles from The Weather Channel | weather.com - The Weather Channel",2020-09-21
Climate change since 2000 will cut U.S. growth over next 30 years - CBO - Reuters,2020-09-21
Famous Aspens Expected to Be Hit by Climate Change - Treehugger,2020-09-21
Children urged to strike against lack of action on climate emergency - The Guardian,2020-09-21
"Human-induced climate change could increase 'Medicanes', say experts - Down To Earth Magazine",2020-09-21
"Climate Week 2020 — Free Livestreams, Film Screenings, and Discussions - Green Matters",2020-09-21
Wildfires and hurricanes make climate change a volatile political issue for voters this November - Hartford Courant,2020-09-21
Climate campaigners turn their focus from fossil fuels to meat - Financial Times,2020-09-21
Climate change blamed as Arctic Ocean ice cover shrinks to second-lowest level on record - ABC News,2020-09-21
"'Wildfires are climate fires': How to talk about climate emergency, global heating - DW (English)",2020-09-21
"People care more about climate change than saving money, says survey - Euronews",2020-09-21
Rising ocean temperatures due to climate change may shrink the breathable ranges of marine animals - Oceanographic - Oceanographic - Oceanographic Magazine,2020-09-21
UK plan to use all-male team to host UN climate summit angers observers - The Guardian,2020-09-21
Liberals say a new climate plan is still in the works despite pandemic - CBC.ca,2020-09-21
Davos group sets new framework for 'green' corporate reporting - Reuters UK,2020-09-21
"Paid Letter: Senate candidates Lindsey Port and Dan Hall have few similarities, stark differences - SW News Media",2020-09-21
Why Climate Change is an Environmental Justice Issue - State of the Planet,2020-09-22
"CLIMATE CHANGE: As scientists issue dire warnings, how will 2020 voters in FL respond? - Florida Phoenix",2020-09-22
"Anthropogenic climate change accelerating faster than earlier, natural analogs - Advanced Science News",2020-09-22
What Investors Can Do to Fight Climate Change - Barron's,2020-09-22
How African Elephants Fight Climate Change – IMF F&D - International Monetary Fund,2020-09-22
Helping Underserved Floridians Fight Climate Change - NRDC (Natural Resources Defense Council),2020-09-22
"China, in Pointed Message to U.S., Tightens Its Climate Targets - The New York Times",2020-09-22
Climate Clock in Union Square Counts Time Left for Climate Change Action - Untapped New York,2020-09-22
The intersection of climate and health: Stanford group works for change - Scope,2020-09-22
Morgan Stanley and Walmart set sights on zero emissions while GE pulls the plug on new coal plant construction - The Washington Post,2020-09-22
"As the Climate Changes, How Will Birds Weather Heavier Rains and Snows? - National Audubon Society",2020-09-22
Trump's energy secretary questions mainstream science on human impacts of climate change - WHYY,2020-09-22
Climate explained: humans have dealt with plenty of climate variability - The Conversation AU,2020-09-22
"Rising Temperatures From Climate Change And Extreme Wildfires Go 'Hand-In-Hand,' Scientist Says - Here And Now",2020-09-22
Unfold Podcast Launches Season 2 Focused on Climate Change - UC Davis,2020-09-22
Facebook suspends environmental groups despite vow to fight misinformation - The Guardian,2020-09-22
5 Climate Change Myths You Need To Stop Believing Right Now - Well+Good,2020-09-22
"Climate action: Fear hasn’t motivated people, so let’s get them excited - Fortune",2020-09-22
A third of my country was just underwater. The world must act on climate - The Guardian,2020-09-22
Netflix Releases 'Kiss the Ground' Documentary on Climate Change - WWD,2020-09-22
"Tree planting is critical for sustainable future but can't fix climate change on its own - CIFOR Forests News - Forests News, Center for International Forestry Research",2020-09-22
Media must put the existential threat of climate change front and center - The Washington Post,2020-09-22
"Bill Gates, Jeff Bezos, Eric Schmidt: How to protect the U.S. from climate change and future pandemics - CNBC",2020-09-22
"Think international to end climate change, the wonder of flies, and the fourth wave of globalization: Books in brief - Nature.com",2020-09-22
"BlackRock, Vanguard aren't pushing companies on climate change – report - Pensions & Investments",2020-09-22
"Supreme Court case on carbon price is about climate change, not the Constitution - The Conversation CA",2020-09-22
"Agriculture Subsidies Can Fight Climate Change and Protect Food Security, According to World Bank – Food Tank - Food Tank",2020-09-22
"Boris Johnson, United Nations, Climate Change: Your Wednesday Briefing - The New York Times",2020-09-22
Climate change: How the richest countries contribute to it - CBBC Newsround,2020-09-22
Trump administration eyes scientist who downplays climate change for top NOAA job - The Independent,2020-09-22
Will Climate Change Drive Komodo Dragons Extinct? - Forbes,2020-09-22
Why we need international cooperation now more than ever - World Economic Forum,2020-09-22
Antarctic krill take refuge from climate change - Phys.org,2020-09-22
How Justice Ginsburg's Death Could Affect Future Climate Rulings - Scientific American,2020-09-22
What 'net-zero carbon' really means for cities - BBC News,2020-09-22
"The impact of biodiversity loss, climate change on human health - Deccan Herald",2020-09-22
Letter: Climate change is melting glaciers — and Utah’s snowpack - Deseret News,2020-09-22
Parliament asked ordinary people what the UK should do about climate change – here's what they said - Greenpeace UK,2020-09-22
Quannah Chasinghorse Is Fighting to Save the Arctic National Wildlife Refuge - Teen Vogue,2020-09-22
"Fighting climate change urgent as battling COVID-19, Duterte tells UN - ABS-CBN News",2020-09-22
Govt plans to assess the need for climate change... - The Malaysian Reserve,2020-09-22
Fungi in a warmer world - EurekAlert,2020-09-22
Research dives deep to understand climate impacts on whales - Griffith News,2020-09-22
Climate change leads to devastating global wildfires - ITV News,2020-09-22
"As California wildfires rage, the harvest goes on - Food & Environment Reporting Network",2020-09-22
Michigan clinicians rally to address climate change as a public health issue - Concentrate,2020-09-23
Lee van der Voo on the landmark legal fight against climate change - Street Roots News,2020-09-23
The Apocalypse Is Now: We Need Immediate Action Against Climate Change To Survive - Well+Good,2020-09-23
Climate Change Is Taking A Toll On The Human Body - Here And Now,2020-09-23
"Whitmer signs executive order on climate change, aims for carbon-neutral state by 2050 - Detroit Free Press",2020-09-23
Climate scientists are terrified of a second Trump term - MIT Technology Review,2020-09-23
New poll finds a surprising 7 out of 10 voters favor strong government action to tackle climate change | TheHill - The Hill,2020-09-23
The Case for Calling Climate Change “Genocide” - The New Republic,2020-09-23
State Climate Change Efforts Stall During Pandemic - U.S. News & World Report,2020-09-23
China's carbon neutral pledge could curb global warming by 0.3°C: researchers - Reuters,2020-09-23
We need to act boldly now if we are to avoid economy-wide lockdowns to halt climate change - MarketWatch,2020-09-23
Why a Climate Refugee Crisis Is Actually Far From Inevitable - Global Citizen,2020-09-23
Reporter Debrief: Climate Change And Forest Fires In The Northeast - Vermont Public Radio,2020-09-23
Why is reaching 'net zero emissions' so important? | World Economic Forum - World Economic Forum,2020-09-23
Climate Change Inspires Roseate Spoonbills to Relocate | WGCU PBS & NPR for Southwest Florida - WGCU News,2020-09-23
New Commission Launches to Help Schools Confront Climate Change - Harvard Graduate School of Education,2020-09-23
The daring plan to save the Arctic ice with glass - BBC News,2020-09-23
Beaufort Co. ranks No. 1 in US for climate change risks. It’s not just sea level rise - Hilton Head Island Packet,2020-09-23
"Wildfires, Greenhouse Gas Emissions and Climate Change - Future Directions International",2020-09-23
"The Warming Climates of the Arctic and the Tropics Squeeze the Mid-latitudes, Where Most People Live - InsideClimate News",2020-09-23
"For Democrats, infrastructure equals fighting climate change, creating jobs - Roll Call",2020-09-23
Will We Be Able to Reverse Trump’s Climate Damage? - Rolling Stone,2020-09-23
Global warming may lead to practically irreversible Antarctic melting - Science News,2020-09-23
"To build back better, international cooperation on climate change is needed - EURACTIV",2020-09-23
Young evangelicals used to be skeptical of climate change. Not anymore. And we’re voting. - Grist,2020-09-23
"Despite speculation, Northwestern climate scientists say COVID-19 is not slowing climate change - Daily Northwestern",2020-09-23
Cryan: Climate change is an urgent threat to New Jersey - New Jersey Globe | New Jersey Politics,2020-09-23
"Apple CEO says climate change is here with wildfires, hurricanes, flooding - CNET",2020-09-23
