Title,Date
"Greenland Ice Melting Now Irreversible, Has Passed ""Tipping Point"": Study - NDTV",2020-08-17
Reforestation may not be a cheap climate fix; nature-based solution must consider trade-offs: Study - The Straits Times,2020-08-17
Greenland Ice Sheet Passes Point of No Return Due to Climate Change: Study - News18,2020-08-17
How are Europe's cities coping with extreme hot weather? - World Economic Forum,2020-08-17
California Blackouts a Warning for States Ramping Up Green Power - The Wall Street Journal,2020-08-17
"Chinese teenage climate warrior, Howey Ou, fights a lonely battle to save the world - Gulf Today",2020-08-17
Cyber Doctrines and the Risk of Nuclear Crisis Instability. Part 1: Issues with U.S. Cyber Strategy - Council on Foreign Relations,2020-08-17
"The tropics are expanding, and climate change is the primary culprit - Science Daily",2020-08-18
Recent global warming trends are inconsistent with very high climate sensitivity - Science Daily,2020-08-18
"Climate Change Will Make Beer Taste Different (Yes, Really) - NC State News",2020-08-18
The first undeniable climate change deaths - Grist,2020-08-18
Explainer: Cleaner but not clean - Why scientists say natural gas won't avert climate disaster - Reuters,2020-08-18
Climate change: Sensitive global warming forecasts were overestimated for 50 years - study - Daily Express,2020-08-18
‘Climate Donors’ Flock to Biden to Counter Trump’s Fossil Fuel Money - The New York Times,2020-08-18
"In Brazil, human action and climate change are drowning a community - Mongabay.com",2020-08-18
California heat wave: Climate change kindles extreme weather - Los Angeles Times,2020-08-18
"When Colorado's Air Quality Commission Reconvenes To Talk Climate Change Policy, Some Of Its Most Vocal Advocates Won't Be There - Colorado Public Radio",2020-08-18
Extreme Heat Exposure Could Really Ramp Up in U.S. Cities - Scientific American,2020-08-18
Climate change could bring heat 'health crisis' to U.S. cities - Medical Xpress,2020-08-18
Why 'Degrowth' May Be Necessary to Prevent Climate Catastrophe - Bloomberg,2020-08-18
MSCI launches climate change indexes for China stocks - Reuters,2020-08-18
New York’s Heat-Vulnerable Neighborhoods Need to Go Green to Cool Off - InsideClimate News,2020-08-18
How Birds Respond to Extreme Weather - NASA,2020-08-18
Dozens of US nuclear power plants at risk due to climate change: Moody's - S&P Global,2020-08-18
Climate change: Scientists sound alarm on risk of 'mega-tsunamis' and deadly landslides - Daily Express,2020-08-18
"Where Biden and AOC's Policies on Climate Change, Immigration and Health Care Differ - Newsweek",2020-08-18
Potential and constraints of reforestation for climate mitigation - Science Daily,2020-08-18
How the COVID-19 pandemic is teaching us to tackle the climate crisis - PLoS Blogs,2020-08-18
Climate change sends melting Greenland ice 'past tipping point' - The Local Denmark,2020-08-18
New radiant cooling technology could mitigate climate change and COVID-19 - News-Medical.Net,2020-08-18
Cold-weather accounts for almost all temperature-related deaths - Science Daily,2020-08-18
"GUEST EDITORIAL: As climate change threatens Florida, resilience should not be a part-time job - St. Augustine Record",2020-08-18
Concordia student maps global primate habitat endangered by climate change - Concordia University News,2020-08-18
Climate change impact on green energy product - EurekAlert,2020-08-18
Climate and extinction crises require urgent change | TheHill - The Hill,2020-08-18
Climate grief expected to be widespread soon but it's still not openly acknowledged - ABC News,2020-08-18
Kensington Palace and Hampton Court Gardens Face Climate Change Challenges - HouseBeautiful.com,2020-08-18
"If You Like Lockdowns, You’ll Love the Carbon-Free Future - The Wall Street Journal",2020-08-18
"Cooking in quarantine reduces food waste, could help climate change - Fox News",2020-08-18
"In the Scottish moorlands, plots planted with trees stored less carbon than untouched lands: Study - Mongabay.com",2020-08-18
NASA Study Maps the Roots of Global Mangrove Loss - NASA,2020-08-18
Minister of Climate Change reinforces importance of green economy as cornerstone for post-COVID-19 recovery - WAM EN,2020-08-18
19 August 2020: Environment Bill - environmental targets - GOV.UK,2020-08-18
Human-induced change could affect as much as half of the world's oceans - The Green News,2020-08-18
13 major climate change reports released so far in 2020 - Yale Climate Connections,2020-08-19
Mangroves Could Help Save Us From Climate Change. Climate Change Is Killing Mangroves. • The Revelator - The Revelator,2020-08-19
The Climate Crisis Is Still a Crisis - The Atlantic,2020-08-19
‘Where did the climate come from?’ and other kids’ questions about climate change - Yale Climate Connections,2020-08-19
Generation Z is ‘traumatized’ by climate change—and they’re the key to fighting it - Fortune,2020-08-19
What Changed—and What Didn't—in Democrats' Climate Platform - Scientific American,2020-08-19
Climate Change Could Put $4.7 Trillion of Asia's Annual GDP at Risk by 2050 - Global Citizen,2020-08-19
California Overlooked Impact of Climate-fueled Extremes - NPR,2020-08-19
"After Two Nights of Speeches, Activists Ask: Hey, What About Climate Change? - InsideClimate News",2020-08-19
"We need another New Deal, but with climate change action - Los Angeles Times",2020-08-19
How could a Biden presidency affect climate change investing? | Greenbiz - GreenBiz,2020-08-19
"Weather Blog: The link between ticks, poison ivy and climate change - WRDW-TV",2020-08-19
COVID-19 Lockdown Demonstrates How Economy-Wide Transformation Can Halt Climate Change - YES! Magazine,2020-08-19
How fighting coronavirus can inspire climate action - World Economic Forum,2020-08-19
"Professor: Several factors feeding wildfires, including climate change - KOAA.com Colorado Springs and Pueblo News",2020-08-19
Meet the scientists going to extreme lengths to study climate change - BBC Focus Magazine,2020-08-19
Climate Change Threatens Nuclear Power Due to Global Warming - Bloomberg,2020-08-19
Climate crisis — we need to put our money where our mouths are | TheHill - The Hill,2020-08-19
Climate change is decoupling bee lifecycles from that of flowers - ZME Science,2020-08-19
"Out of sync: Ecologists report climate change affecting bee, plant life cycles - Science Daily",2020-08-19
One key solution to the world's climate woes? Canada's natural landscapes – Great Lakes Now - Great Lakes Now,2020-08-19
"Women Are Most Likely To Die From Climate Change, New Study Finds - CleanTechnica",2020-08-19
"Beer could taste different because of climate change, scientist says - Fox News",2020-08-19
"Democrats adopt platform promising strong action on climate change, energy - S&P Global",2020-08-19
Louisiana Announces First-Ever Climate Goals | Audubon - National Audubon Society,2020-08-19
CPRA chair: Louisiana can no longer afford to politicize climate change - The Advocate,2020-08-19
"Mark Lynas’s ‘Final warning’ on climate: ‘It’s all on us, here, now,’ says reviewer - Yale Climate Connections",2020-08-19
Beaver County municipalities join state climate change program - The Times,2020-08-19
"Gov. John Bel Edwards commits to 25-28% emissions cut by 2025, 'net zero' in Louisiana by 2050 - NOLA.com",2020-08-19
Climate Change shocker: World temperature record set in California's Death Valley - Mirror Now,2020-08-19
How Climate Economics supports the Paris agreement temperature targets - Environmental Defense Fund,2020-08-19
"California power outages underscore challenge of maintaining reliability during climate change, the energy transition - Utility Dive",2020-08-19
"Electric cars can save billions in climate change, air pollution damage - The Driven",2020-08-19
DNC 2020: Democrats drop their demand to end fossil fuel subsidies from their platform - Vox.com,2020-08-19
We owe it to young people to take action on climate change – it’s their future we’re stealing - iNews,2020-08-19
Sponsor of climate language blasts DNC for stripping it from platform - POLITICO,2020-08-19
Citi CEO: Banks must have the courage to walk away from deals that are bad for the climate - CNN,2020-08-19
Security in the Shadow of Climate Change in the Sahel - MDC for Middle Eastern and African Studies,2020-08-19
The heat of the night is when you can really feel climate change in Calgary - CBC.ca,2020-08-19
The world's biggest waves: How climate change could trigger large landslides and 'mega tsunamis' - Canadian Underwriter,2020-08-19
Greta Thunberg says the world is wasting time to stop climate change - Metro.co.uk,2020-08-19
Manitoulin Island and North Shore prepare for climate change - My Eespanola Now,2020-08-19
Gov. Lujan Grisham focuses on climate change during DNC speech - KOB,2020-08-19
FG decries negative impact of COVID-19 on climate change Response - Guardian,2020-08-19
"Why Warren Buffett is betting on energy pipelines even as climate fears, and renewables, are rising - CNBC",2020-08-19
"Where Connecticut, COVID-19, climate change and critters intersect - theday.com",2020-08-19
Special Report: Almost out of time - The Edge Markets MY,2020-08-19
"A Word From Mark Lynas, For Those Who Forgot About The Climate Crisis - Interview",2020-08-19
Switzerland to substantially boost funding of Green Climate Fund - swissinfo.ch,2020-08-19
"How California can keep power on, meet clean energy goals - Los Angeles Times",2020-08-19
Brazil vice president invites DiCaprio to see reality of Amazon rainforest - Metro US,2020-08-19
"Canada’s Trudeau plans sweeping social welfare reform, sources say - Metro US",2020-08-19
Climate change: 'Unprecedented' ice loss as Greenland breaks record - BBC News,2020-08-20
Organic takes on climate change - New Hope Network,2020-08-20
Climate change and global hunger - The Ecologist,2020-08-20
The IPCC's special report on climate change and land: What's in it for Latin America? - World - ReliefWeb,2020-08-20
Daphne Prairie and other Texas grasslands can store carbon and help fight climate change - The Texas Tribune,2020-08-20
"COVID-19 lockdowns will have a negligible effect on climate change, study finds | News | CORDIS | European Commission - Cordis News",2020-08-20
"Science Says: Climate change, people stoke California fires - Associated Press",2020-08-20
Redirect military budgets to tackle climate change and pandemics - Nature.com,2020-08-20
Colorado Wildfires Are Climate Change 'In The Here And Now' — And A Sign Of Summers To Come - Colorado Public Radio,2020-08-20
"Climate change likely to hit hard on the North Shore, new report finds - The Boston Globe",2020-08-20
We pieced together the most precise records of major climate events from thousands of years ago. Here’s what we found - The Conversation AU,2020-08-20
The future of CCUS: New technologies that fight climate change with captured CO2 | Recharge - Recharge,2020-08-20
"Alaska’s salmon are shrinking, and climate change may be to blame - Reuters",2020-08-20
Past rapid warming levels in the Arctic associated with widespread climate changes - Science Daily,2020-08-20
Joe Biden unlikely to push carbon tax as part of climate change plan - Axios,2020-08-20
"North American Forests Struggle to Absorb Excess Carbon, Protect Against Climate Change - capeandislands.org",2020-08-20
"Undeniable climate change impact starting to get priced in: Hilti, Credit Suisse - Artemis.bm",2020-08-20
Mounting Climate Impacts Threaten U.S. Nuclear Reactors - Scientific American,2020-08-20
"Climate change is driving apple orchards higher up in the Himalayas, and geoengineering could be a stopgap - Research Matters",2020-08-20
"Report Warns Climate Change Will Cause More Flooding, Erosion On North Shore - WBUR",2020-08-20
Support Tennessee's farmers in their pivotal role in fight against climate change | Opinion - Commercial Appeal,2020-08-20
The rapid climate changes of the last glacial period - Pursuit,2020-08-20
Gavin Newsom calls for fight against climate change in last-minute convention video - San Francisco Chronicle,2020-08-20
Champagne Harvest 2020: Earliest Start Ever Thanks To Drought And Climate Change - Forbes,2020-08-20
Earth was 130 degrees this week. It will be much hotter one day. - National Geographic,2020-08-20
African World Heritage Sites are under threat from climate change - Quartz Africa,2020-08-20
"Edwards commits to 25-28% emissions cut by 2025, 'net zero' in Louisiana by 2050 - Houma Courier",2020-08-20
Howey Ou is risking it all to put climate change on China's agenda - RFI English,2020-08-20
Kamala Harris' Plan For International Climate Cooperation Could Smooth the Transition From Fossil Fuels - State of the Planet,2020-08-20
Sea stars pushed to edge of extinction by warming oceans - Bulletin of the Atomic Scientists,2020-08-20
Greta Thunberg urges Merkel to get out of climate 'comfort zone' - Reuters,2020-08-20
"Alaskan salmon are decreasing in size thanks to climate change and competition, study says - CNN",2020-08-20
"The climate crisis is an emergency, not an 'issue' - Columbia Journalism Review",2020-08-20
What's the link between storms and climate change? - The Green News,2020-08-20
Gov. Newsom talks climate change amid state's wildfires at Democratic National Convention: 'Climate change is real' - WABC-TV,2020-08-20
Economy and Climate Change Take Center Stage as Kamala Harris Accepts Vice President Nomination - Barron's,2020-08-20
Greta Thunberg warns climate change 'hamster wheel' hindering progress - The Irish Times,2020-08-20
‘Is This Real Life?’ A Wall of Fire Robs a Russian River Town of its Nonchalance - InsideClimate News,2020-08-20
Australia's farmers want more climate action – and they’re starting in their own (huge) backyards - The Conversation Australia,2020-08-20
"Greta Thunberg, Luisa Neubauer demand Merkel 'be brave' on climate change - DW (English)",2020-08-20
Climate Change: Why the Little Things Matter - Redbrick,2020-08-20
"If climate change proceeds, potential ecosystems disasters will be more common - University of Oulu, Finland - Helsinki Times",2020-08-20
Study shows that Greenland's ice sheet has reached 'point of no return' - World Economic Forum,2020-08-20
Fashion needs to ditch fossil fuels in supply chain. A new report shows the way - Down To Earth Magazine,2020-08-20
Climate Change Tracker: The rising threat of humid heatwaves - Livemint,2020-08-20
"California Wildfires, Solutions, Connection To Climate Change / Sound Advice - Capital Public Radio News",2020-08-20
How the pandemic is changing the way leaders approach climate action goals - Eco-Business,2020-08-20
Ben & Jerry's Makes Bold Statement About Climate Change with Launch of New “Unfudge Our Future” Flavor - One Green Planet,2020-08-20
Revealed: how the gas industry is waging war against climate action - The Guardian,2020-08-20
Democratic platform's backtracking on fossil fuels dismays climate activists - The Guardian,2020-08-20
California governor talks climate change at DNC as fires rage - WCTI12.com,2020-08-20
Climate change could mean trouble for surf breaks - Stuff.co.nz,2020-08-20
"Reforestation can help fight climate change, but address economic & social constraints too: NUS-led study - Mothership.sg",2020-08-20
Read Joe Biden's full 2020 Democratic National Convention speech - CNBC,2020-08-20
What will it take for FEMA to take climate change seriously? | TheHill - The Hill,2020-08-21
The Carbon Brief Profile: Nigeria - Carbon Brief,2020-08-21
Fleeing the Climate: the 'Great Migration' Ahead - State of the Planet,2020-08-21
Climate change is creating extreme weather in the US - The Washington Post,2020-08-21
"Phoenix will feel the heat at extreme levels more often in the coming years, study says - AZCentral",2020-08-21
"When It Comes to Climate Change, It’s Joe Biden Versus the DNC - The Nation",2020-08-21
The climate crisis has already arrived. Just look to California’s abnormal wildfires - The Guardian,2020-08-21
MEDIA: On climate change and Colorado wildfire coverage - The Colorado Independent,2020-08-21
COVID-19 pandemic gives new impetus in response to climate change: WHO chief - Xinhua | English.news.cn - Xinhua,2020-08-21
Guest opinion: How protecting our ocean can protect us from climate change - News-Press,2020-08-21
"Science says: Climate change, people stoke California fires - The Salem News",2020-08-21
‘We are almost out of time on climate change’ - The Manila Times,2020-08-21
The Loophole Allowing Climate Change Denial to Spread On Facebook - VICE,2020-08-21
"Bad, Better, Best: The Climate Impact of Meat - Earth911.com",2020-08-21
How can we tackle global debt and climate change together? | World Economic Forum - World Economic Forum,2020-08-21
New World Temperature Record Set - Is Climate Change To Blame? - Forbes,2020-08-21
General Mills believes farmers have a massive role to play in solving climate change - Successful Farming,2020-08-21
How Tennessee farmers are helping to fight climate change | Opinion - Tennessean,2020-08-21
Climate change: How the Sahara Desert has been changed by global warming - iNews,2020-08-21
Tennessee Republican Congressman Tim Burchett to appear at virtual climate conference - Knoxville News Sentinel,2020-08-21
Climate Goal Bill For California Lands Fails To Reach Senate Vote - California Globe,2020-08-21
Watch the Trailer for Ian Somerhalder's Hopeful Netflix Documentary on Climate Change - TV Guide,2020-08-21
"Municipal bonds: 5 studies on racism, climate change + aging populations - Journalist's Resource",2020-08-21
Sustainable cement: the simple switch that could massively cut global carbon emissions - The Conversation UK,2020-08-21
UN chief warns against ‘postponement of climate action’ - POLITICO.eu,2020-08-21
Why hybrid meetings are the future for the IPCC - World Economic Forum,2020-08-21
EarthBeat Weekly: Wildfires blaze a climate warning | Earthbeat - National Catholic Reporter,2020-08-21
The great climate migration has already begun - Irish Examiner,2020-08-21
"Amazon 'women warriors' show gender equality, forest conservation go hand in hand - Mongabay.com",2020-08-21
Book review of To Start a War: How the Bush Administration Took America into Iraq by Robert Draper - The Washington Post,2020-08-21
blackbear: everything means nothing Album Review - Pitchfork,2020-08-21
California is now the world's warning on climate change - Los Angeles Times,2020-08-22
Researchers predict Campylobacter increase due to climate change - Food Safety News,2020-08-22
California and Colorado Fires May Be Part of a Climate-Driven Transformation of Wildfires Around the Globe - InsideClimate News,2020-08-22
What Is Causing Those Fires And Blackouts In California? Could It Be (Gasp!) Climate Change? - CleanTechnica,2020-08-22
The Observer view on the climate catastrophe facing Earth - The Guardian,2020-08-22
Surviving Climate Change In ASEAN’s Cities - The ASEAN Post,2020-08-22
Opinion | How to Reverse Course on Trump’s Environmental Damage - The New York Times,2020-08-22
World champions: Five women working to save us from climate change disaster - Stuff.co.nz,2020-08-22
The Holy War against Climate Change - FSView & Florida Flambeau,2020-08-23
"Climate change is driving wildfires, tropical storms - PBS NewsHour",2020-08-23
Up to Half of The World's Oceans Are Already Affected by Climate Change - ScienceAlert,2020-08-23
"Cooked salmon: Climate change, dams contribute to lethal habitat - The Spokesman-Review",2020-08-23
How Big Data Helps in the Fight Against Climate Change - insideBIGDATA,2020-08-23
Fight Climate Change With Your Undies — A Hang Drying Manifesto - CleanTechnica,2020-08-23
Bangladesh to Kickstart Climate Change Plan With $2 Billion Loan - Bloomberg,2020-08-23
"Deadly fires, hurricanes, floods: Here's why the situation is getting worse - CNET",2020-08-23
Mitigating COVID-19 and Climate Change With Innovative Alternative Cooling Strategies - SciTechDaily,2020-08-23
An off-the-wall solution to climate change - World Finance,2020-08-23
Storebrand dumps oil and mining stocks on climate change lobbying - Financial Times,2020-08-23
"Are the historic heat, lightning storms and fires caused by climate change? We asked climate scientists - The Mendocino Voice",2020-08-23
Canadian oil giants emphasize climate change and diversity as they compete for investment - CBC.ca,2020-08-23
Climate denial - Newspaper - DAWN.COM - DAWN.com,2020-08-23
"Government of Sudan, Green Climate Fund, UNDP sign grant to support 3.7m people with climate-resilient water and food security - Sudan - ReliefWeb",2020-08-23
Climate change: A health challenge even as India struggles in pandemic - Business Standard,2020-08-23
"Global warming: 28 trillion tonnes of ice lost since 1994, study finds - Business Insider",2020-08-23
Climate change needs Covid-level urgency from politicians - Stuff.co.nz,2020-08-23
"Alison Phipps: Science, psychology and climate change warriors in the storm - The National",2020-08-23
"Opinion: Rethinking U.S. national security: masks, not missiles - The Mercury News",2020-08-23
Fast-Moving California Wildfires Boosted by Climate Change - Scientific American,2020-08-24
Biodiversity at the poles: how is climate change affecting it? - Landscape News,2020-08-24
California's new normal: How the climate crisis is fueling wildfires and changing life in the Golden State - CNN,2020-08-24
"Climate Is Taking On a Growing Role for Voters, Research Suggests - The New York Times",2020-08-24
Climate Change and the American Political Agenda - State of the Planet,2020-08-24
COVID-19 and Climate Change - World - ReliefWeb,2020-08-24
'Extreme' Glacier Loss Events Linked to Human-Caused Climate Change for First Time - Resilience,2020-08-24
Climate change is worsening California’s hellish wildfires - Yale Climate Connections,2020-08-24
"Stop Blaming Climate Change For California’s Fires. Many Forests, Including The Redwoods, Need Them. - Forbes",2020-08-24
Climate change: New UK law to curb deforestation in supply chains - BBC News,2020-08-24
Why does Joe Biden call climate change an ‘enormous opportunity’? - Grist,2020-08-24
Negative emissions technologies may not solve climate crisis - Science Daily,2020-08-24
Congressman says both sides need better dialogue on climate change - Deseret News,2020-08-24
Climate Change Already Affecting More Than Half of World’s Oceans - SciTechDaily,2020-08-24
California Is a Preview of Climate Change’s Devastation for the Entire World - World Politics Review,2020-08-24
28 trillion tonnes of ice lost to global warming since 1994 - World Economic Forum,2020-08-24
"Norway’s Biggest Private Money Manager Exits From Exxon, Chevron Over Climate Change - Wall Street Journal",2020-08-24
"Blazes in Colorado, California may be part of a climate-driven transformation of wildfires around the globe - The Colorado Sun",2020-08-24
Climate change: Removing CO2 could spark big rise in food prices - BBC News,2020-08-24
Iowa's changing climate is having a bigger impact on agriculture - Local 5 - weareiowa.com,2020-08-24
Seychelles to benefit from $50 million in climate change project grant money - Seychelles News Agency,2020-08-24
Climate change and land use are accelerating soil erosion by water - Phys.org,2020-08-24
"Climate chaos: Extreme heat, wildfires and record-setting storms suggest a frightening future is already here - CBS News",2020-08-24
Waterbirds are being forced out of the tropics by climate change - Earth.com,2020-08-24
Species 'pushed out of the tropics' by climate change - UQ News,2020-08-24
Climate Change: Stronger Typhoons Growing Threat For Asia - Green Queen Media,2020-08-24
How can Trump ignore climate crisis with twin hurricane-season storms barreling toward us? - USA TODAY,2020-08-24
Former U.S. Rep. Bob Inglis: Florida conservatives embrace climate action | Opinion - Florida Today,2020-08-24
First-of-its-kind summit to push development banks on climate - Devex,2020-08-24
"Climate change: Brace for more floods and droughts as Arctic ice melts, expert warns - Daily Express",2020-08-24
Stephen Fry urges people to stand with Extinction Rebellion against 'sickening' climate science deniers - The Independent,2020-08-24
The Republicans' big plan for the climate crisis in 2020 - nothing - The Independent,2020-08-24
Guest post: Are European cities delivering on their climate commitments? - Carbon Brief,2020-08-24
Rhode Island Leads Way When it Comes to Climate Warming — ecoRI News - ecoRI news,2020-08-24
The UK Conservative case for action on the environment - Financial Times,2020-08-24
German Social Democrats gear up for a climate election campaign - EURACTIV,2020-08-24
Greta Thunberg returns to school after year of climate activism - The Guardian,2020-08-24
"Australia's Chief Scientist is wrong on gas, say leading experts - Sydney Morning Herald",2020-08-24
Sustainability 1: can nurses reduce the environmental impact of healthcare? - Nursing Times,2020-08-24
Slap a fee on fossil fuels and the world’s climate will improve immediately - Chicago Sun-Times,2020-08-24
Governor launches Nevada climate initiative - Las Vegas Sun,2020-08-24
"Devastated by pandemic, tourism sector must be rebuilt in a safe, equitable and climate friendly way – UN chief - UN News",2020-08-24
Climate Change and the Challenge of Community Relocation - NC State News,2020-08-25
U.S. Senate Democrats unveil $400 billion-a-year plan to tackle climate change - Reuters,2020-08-25
6 ways to change climate concern into action - Ensia,2020-08-25
How Cities Can Fight Inequality and Climate Change at Once - U.S. News & World Report,2020-08-25
Senate Democrats want a climate change coalition that can take on the Kochs - Vox.com,2020-08-25
"What demographic group cares the most about climate change? Latinos, Yale researchers say. - Bulletin of the Atomic Scientists",2020-08-25
